OID_,OBJECTID,URL_PATH,IMAGE_PATH,IMAGE_ALT_,PHOTOCREDI,PAGETITLE,LASTMODIFI,LATITUDE,LONGTITUDE,ADDRESS,POSTALCODE,OVERVIEW,EXTERNAL_L,META_DESCR,OPENING_HO,INC_CRC,FMEL_UPD_D,X_ADDR,Y_ADDR
98,99,www.yoursingapore.com/en/see-do-singapore/culture-heritage/heritage-discovery/katong-antique-house.html,www.yoursingapore.com/content/dam/desktop/global/see-do-singapore/culture-heritage/katong-antique-house-carousel01-rect.jpg,Marvel at antiques and heirlooms worthy of any museum collection at the Katong Antique House., ,Katong Antique House Singapore: Peranakan Heritage,2015-09-08T14:39:06.950+08:00,1.30726,103.90714,208 East Coast Road, ,"Step into this fully restored bona fide Peranakan family home, and admire the many antiques and heirlooms worthy of any museum collection.", ,"Step into this fully restored bona fide Peranakan family home, and admire the many antiques and heirlooms worthy of any museum collection.","Daily, 11am is fully restored bona fide Peranakan family home, and admire the many antiques and heirlooms worthy of any museum collection.",EEE9BA07393BE752,9/1/2017 0:00,36215.6407,32175.8076
99,100,www.yoursingapore.com/en/see-do-singapore/nature-wildlife/parks-gardens/chinese-garden.html,www.yoursingapore.com/content/dam/desktop/global/see-do-singapore/nature-wildlife/chinese-garden-carousel01-rect.jpg,"Step back in time to ancient China at the beautiful Chinese Garden, Singapore.",Vincent Chong,Chinese Garden Singapore,2015-10-02T11:19:38.384+08:00,1.338611,103.73,1 Chinese Garden Road, ,A tranquil patch of imperial China in the west of Singapore is pleasant respite from the bustle of the city.,http://www.nhb.gov.sg/resources/virtual-exhibitions-and-tours/walking-through-heritage/chinese-garden,A tranquil patch of imperial China in the west of Singapore is pleasant respite from the bustle of the city.,"Daily, 6am patch of imperial China in the west of Singapore is pleasant respite from the bustle of the city.",F6B5F576D5EBDFC7,9/1/2017 0:00,16501.7399,35642.5618
100,101,www.yoursingapore.com/en/see-do-singapore/nature-wildlife/parks-gardens/east-coast-park.html,www.yoursingapore.com/content/dam/desktop/global/see-do-singapore/nature-wildlife/east-coast-park-carousel03-rect.jpg,"Whether you prefer water sports, rollerblading or cycling, find a myriad of things to do at East Coast Park, Singapore.",Joel Chua DY,East Coast Park Singapore,2015-10-02T14:29:32.607+08:00,1.300784,103.912187,Along East Coast Parkway and East Coast Park Service Road,0,"With so many attractions packed into this 15-km stretch of beaches, youd of things to do at East Coast Park, Singapore.",http://www.nparks.gov.sg/cms/index.php?option=com_visitorsguide&task=parks&id=14&Itemid=371,"With so many attractions packed into the 15-km stretch of beaches at East Coast Park, you71", ,7857B89E1D54DD1E,9/1/2017 0:00,36777.3479,31459.7412
101,102,www.yoursingapore.com/en/see-do-singapore/nature-wildlife/parks-gardens/fort-canning-park.html,www.yoursingapore.com/content/dam/desktop/global/see-do-singapore/nature-wildlife/fort-canning-park-carousel01-rect.jpg,"Take a stroll back in time at Fort Canning Park, Singapore - a landmark full of history.",Joel Chua DY,Fort Canning Park,2015-10-02T14:32:42.018+08:00,1.295382,103.846509,"Bounded by Hill Street, Canning Rise, Clemenceau Avenue and River Valley Road", ,"Whether youHill Street, Canning Rise, Clemenceau Avenue and River Valley Road",http://www.nparks.gov.sg/cms/index.php?option=com_visitorsguide&task=parks&id=16Th,Whether younparks.gov.sg/cms/index.php?option=com_visitorsguide&task=parks&id=16Th, ,F169EFB0AF75CC3C,9/1/2017 0:00,29467.9781,30862.2827
102,103,www.yoursingapore.com/en/see-do-singapore/nature-wildlife/singapore-islands/kusu-island.html, , , ,"Kusu Island, Singapore",2015-09-09T09:44:33.992+08:00,1.2230965,103.8605232,Kusu Island, ,If yousland,http://www.sentosa.com.sg/en/nature/southern-islands/kusu-island/,"Kusu Island lies to the south of Singapore, and has a wonderful mix of local heritage and beach activities.", ,986FE9B794D5E201,9/1/2017 0:00,31027.7192,22869.3386
103,104,www.yoursingapore.com/en/see-do-singapore/nature-wildlife/fun-with-animals/jurong-bird-park.html,www.yoursingapore.com/content/dam/desktop/global/see-do-singapore/nature-wildlife/jurong-bird-park-carousel01-rect.jpg,Enjoy close encounters with some of our prettiest and rarest feathered friends at the Jurong Bird Park., ,"Jurong Bird Park, Singapore: Attractions & Things to Do",2015-09-22T10:10:33.155+08:00,1.318706,103.706442,2 Jurong Hill, ,"Jurong Bird Park has almost every species to impress avian lovers, along with fun exhibits, interactive shows, and of course, its charming residents.",http://www.birdpark.com.sg,"Jurong Bird Park has almost every species to impress avian lovers, along with fun exhibits, interactive shows, and of course, its charming residents.","Daily, 8.30am - 6pm",7A39FA60326C4AE3,9/1/2017 0:00,13879.8679,33441.6866
104,105,www.yoursingapore.com/en/see-do-singapore/nature-wildlife/parks-gardens/hortpark.html,www.yoursingapore.com/content/dam/desktop/global/see-do-singapore/nature-wildlife/hortpark-carousel01-rect.jpg,"Escape the buzz of the city at HortPark, Singapore.",National Parks Board,HortPark,2015-09-09T09:47:25.899+08:00,1.279069,103.799724,33 Hyderabad Road, ,Lose yourself in this dreamscape of stunning gardens that will make you forget the bustle of city.,http://www.nparks.gov.sg/cms/index.php?option=com_visitorsguide&task=parks&id=17&Itemid=73,HortPark is a gorgeous collection of stunning gardens and plants that will make you  forget about the bustle of city.,"Daily, 6am  a gorgeous collection of stunning gardens and plants that will make you  forget about the bustle of city.",E60460B170B57ADD,9/1/2017 0:00,24261.1939,29058.496
105,106,www.yoursingapore.com/en/see-do-singapore/recreation-leisure/fun-things-to-do/adventure-cove.html,www.yoursingapore.com/content/dam/desktop/global/see-do-singapore/recreation-leisure/adventure-cove-carousel01-rect.jpg,Adventure Cove Waterparkntent/dam/desktop/global/see-do-singapore/recreation-leisure/adventure-cove-carousel01-rect.jpg, ,Adventure Cove Waterparkntent/dam/desktop/global/see-do-singapore/recreation-leisure/adventure-cove-carousel01-rect.jpg,2015-09-23T19:20:35.693+08:00,1.2573388,103.8195254,"8 Sentosa Gateway, Sentosa Island", ,Make a big splash at this aquatic adventure park at Resorts World/recreation-leisure/adventure-cove-carousel01-rect.jpg,http://www.rwsentosa.com/language/en-US/Homepage/Attractions/MarineLifePark/AdventureCoveWaterpark,Adventure Cove Waterpark/language/en-US/Homepage/Attractions/MarineLifePark/AdventureCoveWaterpark,"Daily, 10am ve Waterpark/language/en-US/Homepage/Attractions/MarineLifePark/AdventureCoveWaterpark",8745BEC88DC191EB,9/1/2017 0:00,26464.9175,26655.6626
106,107,www.yoursingapore.com/en/see-do-singapore/architecture/modern/lassalle-college-of-the-arts.html,www.yoursingapore.com/content/dam/desktop/global/see-do-singapore/architecture/lasalle-college-of-the-arts-carousel01-rect.jpg,Lasalle College of the Arts pushes the boundaries of creativity in architecture., ,Lasalle College of the Arts,2015-09-24T12:37:44.129+08:00,1.3029,103.8516,1 McNally Street, ,How can something that fits so perfectly into a cityscape evoke nature as well? It all lies in the design of Lasalle College of the Arts.,https://www.lasalle.edu.sg,How can something that fits so perfectly into a cityscape evoke nature as well? It all lies in the design of Lasalle College of the Arts.,"Administration Office Monday to Friday, 9am o a cityscape evoke nature as well? It all lies in the design of Lasalle College of the Arts.",C3B4EB775480D9C4,9/1/2017 0:00,30034.5559,31693.5879
